{
		"xAxis": "Oblique",
		"obliqueXDim1": "Left",
		"obliqueXDim2": "Anterior",
		"obliqueXDim3": "Inferior",
		"yAxis": "Left-to-right",
		"obliqueYDim1": "Left",
		"obliqueYDim2": "Anterior",
		"obliqueYDim3": "Inferior",
		"zAxis": "Anterior-to-posterior",
        "obliqueZDim1": "Right",
		"obliqueZDim2": "Posterior",
		"obliqueZDim3": "Superior",
        "landmarkX": 5,
        "landmarkY": 20,
        "landmarkZ": 2,
		"Number": 10,
		"displayColor": ["red","blue"],
        "Representation": "rhodopsin",
        "Flurophore": "egfp",
		"stepSizeX": "",
		"stepSizeY": "",
        "stepSizeZ": "",
        "stepSizeT": "",
        "Channel": 3,
        "Slices": 4,
        "t": 3,
        "xSize": 20,
        "ySize": 30,
        "zSize": 40,
        "Gbyte": 2.1,
        "File": 3.2,
        "dimensionOrder": "XYZT"
	}